{
  "$schema": "https://raw.githubusercontent.com/acidicoala/ScreamAPI/master/extra/ScreamAPI.schema.v1.json",
  "version": 1,
  "logging": true,
  "block_metrics": false,
  "catalog_items": {
    "unlock_all": true,
    "override": []
  },
  "entitlements": {
    "unlock_all": true,
    "auto_inject": true,
    "inject": []
  }
}
